{
 "schema_version": "3.0",
 "message_id": "00000000-0000-4000-8000-000000000002",
 "correlation_id": "COR-0002",
 "producer": "TRADE_CORE",
 "created_utc": "2026-09-24T09:00:00Z",
 "command_id": "CMD-00000000000B",
 "payload_sha256": "0000000000000000000000000000000000000000000000000000000000000002",
 "account_ref": "ACC-DEMO0001",
 "mode": "PAPER",
 "instrument_id": "INS-COMEX-MGC",
 "broker_symbol": "MGCZ26",
 "strategy_id": "S-TF",
 "order_kind": "CLOSE",
 "mt5_action": "TRADE_ACTION_DEAL",
 "side": "SELL",
 "qty": 1,
 "position_ticket": 5550001,
 "magic": 110002,
 "comment": "C00000000000B",
 "risk_decision_ref": "RD-0002",
 "grant_id": "GR-PAPER-0001",
 "profile": "H5"
}
