{
 "schema_version": "3.0",
 "message_id": "00000000-0000-4000-8000-000000000001",
 "correlation_id": "COR-0001",
 "producer": "TRADE_CORE",
 "created_utc": "2026-09-24T09:00:00Z",
 "command_id": "CMD-00000000000A",
 "payload_sha256": "0000000000000000000000000000000000000000000000000000000000000001",
 "account_ref": "ACC-DEMO0001",
 "mode": "PAPER",
 "instrument_id": "INS-COMEX-MGC",
 "broker_symbol": "MGCZ26",
 "strategy_id": "S-TF",
 "order_kind": "ENTRY",
 "mt5_action": "TRADE_ACTION_PENDING",
 "side": "BUY",
 "qty": 1,
 "limit_price": "4228.1",
 "sl_price": "4190.3",
 "time_type": "ORDER_TIME_SPECIFIED",
 "expiry_utc": "2026-09-24T14:00:00Z",
 "magic": 110001,
 "comment": "C00000000000A",
 "risk_decision_ref": "RD-0001",
 "grant_id": "GR-PAPER-0001",
 "profile": "H5"
}
